{
  "AppVersion": "24.7.1.0",
  "Version": "1.0.0.2",
  "Title": "Spider Man",
  "Thumbnail": "thumbnail.jpg",
  "Preview": "preview.gif",
  "Description": "Spider Man - Miles Morales - 4K",
  "Author": "Live Wallpaper",
  "License": null,
  "Contact": "https://www.youtube.com/@live_wallpaper3479",
  "Type": 3,
  "Source": "milesm.mp4",
  "Tags": null,
  "Arguments": null
}