{
  "AppVersion": "24.7.3.0",
  "Version": "1.0.0.0",
  "Title": "Ayleid Ruins",
  "Thumbnail": "thumbnail.jpg",
  "Preview": "preview.gif",
  "Description": "Ayleid Ruins - The Elder Scrolls IV Oblivion - Live Wallpaper",
  "Author": "MoeWalls",
  "License": null,
  "Contact": "https://moewalls.com/games/ayleid-ruins-the-elder-scrolls-iv-oblivion-live-wallpaper",
  "Type": 3,
  "Source": "artesivo.mp4",
  "Tags": [
    "Falling Leaves",
    "Jungle",
    "Birds",
    "River",
    "Boat"
  ],
  "Arguments": null
}