{
  "AppVersion": "24.7.17.0",
  "Version": "1.0.0.0",
  "Title": "Elderwood Gnar",
  "Thumbnail": "thumbnail.jpg",
  "Preview": "preview.gif",
  "Description": "Elderwood Gnar - League of Legends - Live Wallpaper",
  "Author": "Ï€ Wallpapers",
  "License": null,
  "Contact": "https://www.youtube.com/@Pi_Wallpapers",
  "Type": 3,
  "Source": "eglol.mp4",
  "Tags": null,
  "Arguments": null
}