{
  "AppVersion": "24.7.1.0",
  "Version": "1.0.0.2",
  "Title": "Kylo Ren's Lightsaber",
  "Thumbnail": "thumbnail.jpg",
  "Preview": "preview.gif",
  "Description": "Kylo Ren's Lightsaber Ignition - Star Wars",
  "Author": "Raphael Hodjaev",
  "License": null,
  "Contact": "https://www.youtube.com/@rapflapfl",
  "Type": 3,
  "Source": "krli.mp4",
  "Tags": null,
  "Arguments": null
}