{
  "AppVersion": "24.7.1.0",
  "Version": "1.0.0.2",
  "Title": "God of War",
  "Thumbnail": "thumbnail.jpg",
  "Preview": "preview.gif",
  "Description": "God of War 2018 4K",
  "Author": "Gus Blackk",
  "License": null,
  "Contact": "https://www.youtube.com/@gusblackk2013",
  "Type": 3,
  "Source": "gow.mp4",
  "Tags": null,
  "Arguments": null
}