{
  "AppVersion": "24.7.23.0",
  "Version": "1.0.0.0",
  "Title": "Summer Meteor",
  "Thumbnail": "thumbnail.jpg",
  "Preview": "preview.gif",
  "Description": "Summer Meteor - Live Wallpaper",
  "Author": "DesktopHut",
  "License": null,
  "Contact": "https://www.desktophut.com/summer-meteor",
  "Type": 3,
  "Source": "sm.mp4",
  "Tags": [
    "Shooting Star",
    "Skywatching",
    "Stargazing",
    "Astronomy",
    "Night Sky"
  ],
  "Arguments": null
}