{
  "AppVersion": "24.9.21.0",
  "Version": "1.0.0.1",
  "Title": "Neon Sign",
  "Thumbnail": "thumbnail.jpg",
  "Preview": "preview.gif",
  "Description": "Neon Sign - Coca Cola - Live Wallpaper",
  "Author": "MoeWalls",
  "License": null,
  "Contact": "https://moewalls.com/abstract/coca-cola-neon-sign-live-wallpaper",
  "Type": 3,
  "Source": "ccns.mp4",
  "Tags": [
    "Logo"
  ],
  "Arguments": null
}