{
  "AppVersion": "24.8.7.0",
  "Version": "1.0.0.0",
  "Title": "Driving Under The Moonlight In The Forest",
  "Thumbnail": "thumbnail.jpg",
  "Preview": "preview.gif",
  "Description": "Driving Under The Moonlight In The Forest - Live Wallpaper",
  "Author": "MoeWalls",
  "License": null,
  "Contact": "https://moewalls.com/landscape/driving-under-the-moonlight-in-the-forest-live-wallpaper",
  "Type": 3,
  "Source": "dutmitf.mp4",
  "Tags": [
    "Moonlit Night",
    "Shooting Star",
    "Trees",
    "Car"
  ],
  "Arguments": null
}