{
  "AppVersion": "24.9.21.0",
  "Version": "1.0.0.0",
  "Title": "Zoro Sword Fight",
  "Thumbnail": "thumbnail.jpg",
  "Preview": "preview.gif",
  "Description": "Zoro Sword Fight - One Piece - Live Wallpaper",
  "Author": "DesktopHut",
  "License": null,
  "Contact": "https://www.desktophut.com/zoro-sword-fight",
  "Type": 3,
  "Source": "zsfop.mp4",
  "Tags": [
    "Determined",
    "Swordsman",
    "Samurai",
    "Skilled",
    "Vibrant"
  ],
  "Arguments": null
}