{
  "AppVersion": "24.7.7.0",
  "Version": "1.0.0.0",
  "Title": "Petyr Baelish",
  "Thumbnail": "thumbnail.jpg",
  "Preview": "preview.gif",
  "Description": "Petyr Baelish - Game of Thrones - Live Wallpaper",
  "Author": "MoeWalls",
  "License": null,
  "Contact": "https://moewalls.com/movies/petyr-baelish-game-of-thrones-live-wallpaper",
  "Type": 3,
  "Source": "pbgot.mp4",
  "Tags": [
    "Explosion",
    "Frozen",
    "Winter",
    "Cloak",
    "Cape"
  ],
  "Arguments": null
}