{
  "AppVersion": "24.9.14.0",
  "Version": "1.0.0.0",
  "Title": "Luffy One Piece Bird Friendship",
  "Thumbnail": "thumbnail.jpg",
  "Preview": "preview.gif",
  "Description": "Luffy One Piece Bird Friendship - Live Wallpaper",
  "Author": "DesktopHut",
  "License": null,
  "Contact": "https://www.desktophut.com/luffy-one-piece-bird-friendship",
  "Type": 3,
  "Source": "lopbf.mp4",
  "Tags": [
    "Monkey D Luffy",
    "Manga"
  ],
  "Arguments": null
}