{
  "AppVersion": "24.9.21.0",
  "Version": "1.0.0.0",
  "Title": "Gojo Satoru Jujutsu Kaisen Grey",
  "Thumbnail": "thumbnail.jpg",
  "Preview": "preview.gif",
  "Description": "Gojo Satoru Jujutsu Kaisen Grey - Live Wallpaper",
  "Author": "DesktopHut",
  "License": null,
  "Contact": "https://www.desktophut.com/gojo-grey",
  "Type": 3,
  "Source": "gsjkg.mp4",
  "Tags": [
    "Cursed Energy",
    "Action Pose",
    "Anime Hero",
    "Grey Theme",
    "Sorcerer"
  ],
  "Arguments": null
}