{
  "AppVersion": "24.7.28.0",
  "Version": "1.0.0.0",
  "Title": "Sukuna God",
  "Thumbnail": "thumbnail.jpg",
  "Preview": "preview.gif",
  "Description": "Sukuna God - Live Wallpaper",
  "Author": "DesktopHut",
  "License": null,
  "Contact": "https://www.desktophut.com/sukuna-god",
  "Type": 3,
  "Source": "sg.mp4",
  "Tags": [
    "Jujutsu Kaisen",
    "Cursed Spirit",
    "Ryomen Sukuna",
    "Divine Being",
    "Manga"
  ],
  "Arguments": null
}