{
  "AppVersion": "24.7.9.0",
  "Version": "1.0.0.0",
  "Title": "Yoimiya",
  "Thumbnail": "thumbnail.jpg",
  "Preview": "preview.gif",
  "Description": "Yoimiya - Genshin Impact - Live Wallpaper",
  "Author": "DesktopHut",
  "License": null,
  "Contact": "https://www.desktophut.com/Yoimiya-Genshin",
  "Type": 3,
  "Source": "ygi.mp4",
  "Tags": [
    "Bow User",
    "Fantasy",
    "Mihoyo",
    "Fire",
    "Pyro"
  ],
  "Arguments": null
}