{
  "AppVersion": "24.8.8.0",
  "Version": "1.0.0.0",
  "Title": "Zenitsu Agatsuma",
  "Thumbnail": "thumbnail.jpg",
  "Preview": "preview.gif",
  "Description": "Zenitsu Agatsuma - Kimetsu no Yaiba - Live Wallpaper",
  "Author": "DesktopHut",
  "License": null,
  "Contact": "https://www.desktophut.com/zenitsu-kimetsu_fKl",
  "Type": 3,
  "Source": "zakny.mp4",
  "Tags": [
    "Thunder Breathing",
    "Demon Slayer",
    "Yellow Hair",
    "Lightning",
    "Swordsman"
  ],
  "Arguments": null
}