{
  "AppVersion": "24.7.28.0",
  "Version": "1.0.0.0",
  "Title": "Arona and Plana",
  "Thumbnail": "thumbnail.jpg",
  "Preview": "preview.gif",
  "Description": "Arona and Plana - Blue Archive - Live Wallpaper",
  "Author": "MoeWalls",
  "License": null,
  "Contact": "https://moewalls.com/anime/arona-and-plana-blue-archive-live-wallpaper",
  "Type": 3,
  "Source": "aapba.mp4",
  "Tags": [
    "School Uniform",
    "Angel Ring",
    "Short Hair",
    "Blue Hair",
    "Whale"
  ],
  "Arguments": null
}