{
  "AppVersion": "24.7.13.0",
  "Version": "1.0.0.0",
  "Title": "Old Town Rain",
  "Thumbnail": "thumbnail.jpg",
  "Preview": "preview.gif",
  "Description": "Old Town Rain - Live Wallpaper",
  "Author": "DesktopHut",
  "License": null,
  "Contact": "https://www.desktophut.com/old-town-rain",
  "Type": 3,
  "Source": "otr.mp4",
  "Tags": [
    "Aesthetic",
    "Rainy Day",
    "Ambient",
    "Vintage",
    "Cozy"
  ],
  "Arguments": null
}